{
  "incident_id": "NEPAL-RASUWA-2026",
  "title": "Rasuwa / Bhote Koshi Flood and Landslide Disaster",
  "country": "Nepal",
  "jurisdiction": "Bagmati Province / affected districts",
  "event_type": "Flood and landslide disaster",
  "event_date_start": "2026-08-26",
  "event_date_end": null,
  "geographic_scope": "Rasuwa and downstream/connected affected areas",
  "description": "Central identity and status resolution register for people reported missing or out of contact after the August 2026 Rasuwa disaster.",
  "status": "ACTIVE"
}
